{"assetId":"2012","automatedDecision":"needs_review","evaluator":{"mode":"live","model":"gpt-5.4-mini","provider":"openai"},"nodeEvidence":["qualification/2012/52ad655c4ff9df1df2381a3b8cadba0c9369680b3881b2c192ec911f8f9ad5d2/nodes/source/000-specification.json","qualification/2012/52ad655c4ff9df1df2381a3b8cadba0c9369680b3881b2c192ec911f8f9ad5d2/nodes/source/010-file-integrity.json","qualification/2012/52ad655c4ff9df1df2381a3b8cadba0c9369680b3881b2c192ec911f8f9ad5d2/nodes/source/020-semantic.json","qualification/2012/52ad655c4ff9df1df2381a3b8cadba0c9369680b3881b2c192ec911f8f9ad5d2/nodes/source/021-composition.json","qualification/2012/52ad655c4ff9df1df2381a3b8cadba0c9369680b3881b2c192ec911f8f9ad5d2/nodes/source/022-style.json","qualification/2012/52ad655c4ff9df1df2381a3b8cadba0c9369680b3881b2c192ec911f8f9ad5d2/nodes/source/023-safety.json","qualification/2012/52ad655c4ff9df1df2381a3b8cadba0c9369680b3881b2c192ec911f8f9ad5d2/nodes/source/060-use-size-preview.json","qualification/2012/52ad655c4ff9df1df2381a3b8cadba0c9369680b3881b2c192ec911f8f9ad5d2/nodes/source/070-small-scale-readability.json"],"promptRepair":{"maximumAttempts":2,"originalPromptPreserved":true,"revisionNotes":["If repairing, keep the same cottage intact and preserve the right-side shelf/model plus ground shadow with a bit more surrounding transparent margin.","No revision note.","No revision note."]},"promptSha256":"9a2245e2ea1c5c03ec0d94c68b87d6eed264572554360cee9442fbf5e92cb239","recordedAt":"2026-09-13T21:38:53.600555Z","schemaVersion":1,"sha256":"52ad655c4ff9df1df2381a3b8cadba0c9369680b3881b2c192ec911f8f9ad5d2","sourceSha256":null,"specificationSha256":"4e73a5abe9643b0f2027e310579fe8f3abaa8f31a587933600e89c90968014e4","subjectKind":"source","useSizePreview":"qualification/2012/52ad655c4ff9df1df2381a3b8cadba0c9369680b3881b2c192ec911f8f9ad5d2/previews/source-use-sizes.png"}
