{"assetId":"2005","automatedDecision":"qualified","evaluator":{"mode":"live","model":"gpt-5.4-mini","provider":"openai"},"nodeEvidence":["qualification/2005/dd499d5b0de4835899db23587b01eaf03eaa641e3ea357f9e883103b64ebd470/nodes/source/000-specification.json","qualification/2005/dd499d5b0de4835899db23587b01eaf03eaa641e3ea357f9e883103b64ebd470/nodes/source/010-file-integrity.json","qualification/2005/dd499d5b0de4835899db23587b01eaf03eaa641e3ea357f9e883103b64ebd470/nodes/source/020-semantic.json","qualification/2005/dd499d5b0de4835899db23587b01eaf03eaa641e3ea357f9e883103b64ebd470/nodes/source/021-composition.json","qualification/2005/dd499d5b0de4835899db23587b01eaf03eaa641e3ea357f9e883103b64ebd470/nodes/source/022-style.json","qualification/2005/dd499d5b0de4835899db23587b01eaf03eaa641e3ea357f9e883103b64ebd470/nodes/source/023-safety.json","qualification/2005/dd499d5b0de4835899db23587b01eaf03eaa641e3ea357f9e883103b64ebd470/nodes/source/060-use-size-preview.json","qualification/2005/dd499d5b0de4835899db23587b01eaf03eaa641e3ea357f9e883103b64ebd470/nodes/source/070-small-scale-readability.json"],"promptRepair":{"maximumAttempts":2,"originalPromptPreserved":true,"revisionNotes":["If repairing, keep the store unchanged but remove any extra decorative extensions beyond the requested store silhouette.","Replace the black matte with transparency and slightly increase outer safe margin; keep the existing store unchanged.","Remove the pale outer background and the tiny lower-right generator mark only; preserve the full store composition and keep the outer margin transparent.","uncertain: the preview does not provide enough evidence to verify the required transparent outer margin or the removed lower-right generator mark from visible content alone."]},"promptSha256":"8cfaf41329397f7e790c2aa6895283712e3bb60f9d84c9a571f767ce2acfd54b","recordedAt":"2026-09-13T15:15:57.245216Z","schemaVersion":1,"sha256":"dd499d5b0de4835899db23587b01eaf03eaa641e3ea357f9e883103b64ebd470","sourceSha256":null,"specificationSha256":"f5b4f388813609bbab504e11a04f5bcc1b34db6eb93f8e171924a4f98a008977","subjectKind":"source","useSizePreview":"qualification/2005/dd499d5b0de4835899db23587b01eaf03eaa641e3ea357f9e883103b64ebd470/previews/source-use-sizes.png"}
