{"assetId":"1008","automatedDecision":"rejected","evaluator":{"mode":"live","model":"gpt-5.6-sol","provider":"openai"},"nodeEvidence":["qualification/1008/546c07b29740d2e8b5cd9c64aba6b437be9b139fc31fa6ddcc484084d76b905b/nodes/source/000-specification.json","qualification/1008/546c07b29740d2e8b5cd9c64aba6b437be9b139fc31fa6ddcc484084d76b905b/nodes/source/010-file-integrity.json","qualification/1008/546c07b29740d2e8b5cd9c64aba6b437be9b139fc31fa6ddcc484084d76b905b/nodes/source/020-semantic.json","qualification/1008/546c07b29740d2e8b5cd9c64aba6b437be9b139fc31fa6ddcc484084d76b905b/nodes/source/021-composition.json","qualification/1008/546c07b29740d2e8b5cd9c64aba6b437be9b139fc31fa6ddcc484084d76b905b/nodes/source/022-style.json","qualification/1008/546c07b29740d2e8b5cd9c64aba6b437be9b139fc31fa6ddcc484084d76b905b/nodes/source/023-safety.json","qualification/1008/546c07b29740d2e8b5cd9c64aba6b437be9b139fc31fa6ddcc484084d76b905b/nodes/source/060-use-size-preview.json","qualification/1008/546c07b29740d2e8b5cd9c64aba6b437be9b139fc31fa6ddcc484084d76b905b/nodes/source/070-small-scale-readability.json"],"promptRepair":{"maximumAttempts":2,"originalPromptPreserved":true,"revisionNotes":["Add one or two broad, unmistakable card-production features, such as oversized magical cards emerging from a visible press or card-shaped workshop windows, while preserving the entrance, two integrated A emblems, topiary guardians, open wall and garden areas, and clean silhouette. Simplify the smallest cords and facade ornaments for map-scale readability.","Add a second clearly legible integrated A to an existing crest or blank banner, and add broad card-shaped architectural or workshop motifs near the entrance so the Card Factory identity reads immediately without reducing the entrance, silhouette, or open embellishment areas.","Add a second clearly legible integrated A and one or two broad exterior card-making motifs, such as a card-shaped crest or visible magical card output, while preserving the entrance, open overlay areas, and readable silhouette."]},"promptSha256":"4aa6e63e084c6f6c3c165873cc0344fbab3fd3bd492f2c8eb211e1b57db11e68","recordedAt":"2026-09-13T00:50:50.494125Z","schemaVersion":1,"sha256":"546c07b29740d2e8b5cd9c64aba6b437be9b139fc31fa6ddcc484084d76b905b","sourceSha256":null,"specificationSha256":"49d590d9dda2f26f08278b4c386a0d27ede4954a7ff0301b882303083af022ef","subjectKind":"source","useSizePreview":"qualification/1008/546c07b29740d2e8b5cd9c64aba6b437be9b139fc31fa6ddcc484084d76b905b/previews/source-use-sizes.png"}
